{
  "specversion": "1.0",
  "id": "00000000-0000-4000-8000-000000000007",
  "source": "urn:hfs:source:operations",
  "type": "io.github.freeapikeys.hfs.issue.opened.v1",
  "subject": "issue:issue-001",
  "time": "2026-06-05T08:30:00Z",
  "datacontenttype": "application/json",
  "dataschema": "https://freeapikeys.github.io/HackathonSalesforce/events/event-envelope-v1.schema.json",
  "hfstenantid": "demo-mauritius",
  "hfsschemaversion": "1.0.0",
  "hfscorrelationid": "10000000-0000-4000-8000-000000000001",
  "hfsidempotencykey": "operations-issue-001-v1",
  "hfssourcerecordid": "issue-record-001",
  "hfssourcesequence": 2,
  "hfsobservedat": "2026-06-05T08:30:03Z",
  "hfscontenthash": "sha256:56a6f426aa5f34eb9f59d250d587ce835ab7394cc009b70fdb4feada11935c10",
  "data": {
    "recordtype": "Issue",
    "operation": "OPEN",
    "businesskey": "issue-001",
    "effectiveat": "2026-06-05T08:30:00Z",
    "attributes": {
      "agreementkey": "agreement-001",
      "supplierkey": "supplier-001",
      "severity": "HIGH",
      "summary": "Repeated service interruption"
    }
  }
}
