{
  "specversion": "1.0",
  "id": "00000000-0000-4000-8000-000000000011",
  "source": "urn:hfs:source:legal",
  "type": "io.github.freeapikeys.hfs.agreement.updated.v1",
  "subject": "agreement:agreement-001",
  "time": "2026-06-05T08:50:00Z",
  "datacontenttype": "application/json",
  "dataschema": "https://freeapikeys.github.io/HackathonSalesforce/events/event-envelope-v1.schema.json",
  "hfstenantid": "demo-mauritius",
  "hfsschemaversion": "1.0.0",
  "hfscorrelationid": "10000000-0000-4000-8000-000000000001",
  "hfsidempotencykey": "legal-agreement-001-status-v1",
  "hfssourcerecordid": "legal-opinion-001",
  "hfssourcesequence": 1,
  "hfsobservedat": "2026-06-05T08:50:03Z",
  "hfscontenthash": "sha256:66c6c9bf153e834c3c411a9aa20128004abf9a6dc0dca5e6404112d708faba86",
  "data": {
    "recordtype": "Agreement",
    "operation": "UPDATE",
    "businesskey": "agreement-001",
    "effectiveat": "2026-01-01T00:00:00Z",
    "attributes": {
      "reviewnote": "Legal source reports the agreement as terminated."
    },
    "assertions": [
      {
        "conflictkey": "agreement:agreement-001:status",
        "predicate": "status",
        "value": "TERMINATED"
      }
    ]
  }
}
