{
  "specversion": "1.0",
  "id": "00000000-0000-4000-8000-000000000010",
  "source": "urn:hfs:source:operations",
  "type": "io.github.freeapikeys.hfs.issue.updated.v1",
  "subject": "issue:issue-001",
  "time": "2026-06-03T08:45:00Z",
  "datacontenttype": "application/json",
  "dataschema": "https://freeapikeys.github.io/HackathonSalesforce/events/event-envelope-v1.schema.json",
  "hfstenantid": "demo-mauritius",
  "hfsschemaversion": "1.0.0",
  "hfscorrelationid": "10000000-0000-4000-8000-000000000001",
  "hfsidempotencykey": "operations-issue-001-update-v1",
  "hfssourcerecordid": "issue-record-001-update-001",
  "hfssourcesequence": 3,
  "hfsobservedat": "2026-06-05T08:45:00Z",
  "hfscontenthash": "sha256:d6b6e8b844e50a20b4c80b3083f02483c4b7c9f188d3589b9fbe49d0701dd211",
  "data": {
    "recordtype": "Issue",
    "operation": "UPDATE",
    "businesskey": "issue-001",
    "effectiveat": "2026-06-03T08:45:00Z",
    "attributes": {
      "severity": "CRITICAL",
      "summary": "Interruption affected a second business unit"
    }
  }
}
