{
  "specversion": "1.0",
  "id": "00000000-0000-4000-8000-000000000032",
  "source": "urn:hfs:source:nexavenu-revenue",
  "type": "io.github.freeapikeys.hfs.nexavenu.revenue.discovery.readiness.assessed.v1",
  "subject": "sop:SOP-NEXAVENU-DISCOVERY-GATE-001",
  "time": "2026-06-10T08:30:00Z",
  "datacontenttype": "application/json",
  "dataschema": "https://freeapikeys.github.io/HackathonSalesforce/events/event-envelope-v1.schema.json",
  "hfstenantid": "demo-mauritius",
  "hfsschemaversion": "1.0.0",
  "hfscorrelationid": "30000000-0000-4000-8000-000000000001",
  "hfscausationid": "00000000-0000-4000-8000-000000000031",
  "hfsidempotencykey": "nexavenu-discovery-readiness-assessed-v1",
  "hfssourcerecordid": "nexavenu-revenue-event-discovery-gate-001",
  "hfssourcesequence": 4,
  "hfsobservedat": "2026-06-10T08:30:03Z",
  "hfscontenthash": "sha256:45ffe60a85a761be8db5fae6ca1858ad7ae8786770b100ffb4ef9121ac3bcfe5",
  "data": {
    "recordtype": "SOP",
    "operation": "START",
    "businesskey": "SOP-NEXAVENU-DISCOVERY-GATE-001",
    "effectiveat": "2026-06-10T08:30:00Z",
    "attributes": {
      "eventcode": "NEXAVENU_DISCOVERY_READINESS_ASSESSED",
      "pipeline_stage": "sales_discovery",
      "buyer_journey_stage": "test",
      "readiness_score": {
        "value": 48,
        "scale": 100,
        "formula": "problem clarity 10 + stakeholder coverage 8 + system inventory 10 + budget signal 5 + urgency 10 + data readiness 5"
      },
      "handoff_gate": "HOLD",
      "missing_readiness_requirements": [
        "budget owner not confirmed",
        "current systems list incomplete",
        "decision timeline unknown",
        "success metric not agreed"
      ],
      "failure_path": "If readiness remains below 70, keep the lead in nurture and do not consume senior solution-consultant capacity."
    }
  }
}
