{
  "specversion": "1.0",
  "id": "00000000-0000-4000-8000-000000000029",
  "source": "urn:hfs:source:nexavenu-revenue",
  "type": "io.github.freeapikeys.hfs.nexavenu.revenue.lead.source.captured.v1",
  "subject": "prospect:SYNTH-LIFTOPS-MANUFACTURING",
  "time": "2026-06-10T08:00:00Z",
  "datacontenttype": "application/json",
  "dataschema": "https://freeapikeys.github.io/HackathonSalesforce/events/event-envelope-v1.schema.json",
  "hfstenantid": "demo-mauritius",
  "hfsschemaversion": "1.0.0",
  "hfscorrelationid": "30000000-0000-4000-8000-000000000001",
  "hfsidempotencykey": "nexavenu-lead-source-captured-v1",
  "hfssourcerecordid": "nexavenu-revenue-event-lead-001",
  "hfssourcesequence": 1,
  "hfsobservedat": "2026-06-10T08:00:02Z",
  "hfscontenthash": "sha256:15ec846204c98c2dcd963a904d85633b5b0ad3bb7b8d44e4b0582ac3f592f4d9",
  "data": {
    "recordtype": "Issue",
    "operation": "OPEN",
    "businesskey": "ISSUE-NEXAVENU-PIPELINE-LEAK-001",
    "effectiveat": "2026-06-10T08:00:00Z",
    "attributes": {
      "eventcode": "NEXAVENU_LEAD_SOURCE_CAPTURED",
      "giftprofile": "NEXAVENU_REVENUE_INTELLIGENCE",
      "relationshiptype": "prospect",
      "companyid": "SYNTH-LIFTOPS-MANUFACTURING",
      "companyname": "Synthetic LiftOps Manufacturing",
      "industry": "manufacturing-field-service",
      "pipeline_stage": "lead_generation",
      "buyer_journey_stage": "education",
      "lead_source_touchpoints": [
        "Agentforce acceleration webinar registration",
        "LinkedIn outbound reply",
        "MuleSoft modernization landing-page visit"
      ],
      "icp_score": {
        "value": 72,
        "scale": 100,
        "formula": "industry fit 25 + integration complexity 20 + executive intent 15 + data readiness 10 + budget signal 2"
      },
      "qualification_signal": "Interested in AI but not yet educated on data readiness, integration scope, stakeholders, or change-management requirements.",
      "evidence_grade": "synthetic fixture based on public OSINT confluence plus contact-sourced diagnostic assumptions; not public proof"
    }
  }
}
